"Religious Bodies","Tradition","Family","Congregations","Adherents","Adherence Rate"
"African Methodist Episcopal Church","Black Protestant","Methodist Family","4","786","0.67"
"Alliance of Baptists","Mainline Protestant","Baptist Family","1","",""
"American Baptist Association","Evangelical Protestant","Baptist Family","1","150","0.13"
"American Baptist Churches in the U.S.A.","Mainline Protestant","Baptist Family","21","3,095","2.65"
"American Sikh Council","Other","Other Groups Family","2","",""
"Anglican Church in North America","Evangelical Protestant","Anglican/Episcopal Family","2","",""
"Anglican Province of Christ the King","Mainline Protestant","Anglican/Episcopal Family","1","",""
"Antiochian Orthodox Christian Archdiocese of North America","Orthodox","Eastern Liturgical (Orthodox) Family","1","450","0.39"
"Apostolic Faith Mission of Portland, Oregon","Evangelical Protestant","Pentecostal Family","1","",""
"Apostolic Lutheran Church of America","Evangelical Protestant","Lutheran Family","1","",""
"Assemblies of God, General Council of the","Evangelical Protestant","Pentecostal Family","26","8,304","7.12"
"Association of Vineyard Churches","Evangelical Protestant","Pentecostal Family","1","124","0.11"
"Baha'i Faith","Other","Other Groups Family","15","946","0.81"
"Buddhism, Mahayana","Buddhism","Buddhism Family","5","4,579","3.93"
"Buddhism, Theravada","Buddhism","Buddhism Family","3","1,081","0.93"
"Buddhism, Vajrayana","Buddhism","Buddhism Family","4","1,320","1.13"
"Catholic Church","Catholic","Catholic Liturgical Family","39","312,835","268.31"
"Chabad Judaism","Judaism","","8","",""
"Christian and Missionary Alliance","Evangelical Protestant","Holiness Family","4","1,074","0.92"
"Christian Brethren (Plymouth Brethren)","Evangelical Protestant","Independent Fundamentalist Family","3","",""
"Christian Church (Disciples of Christ)","Mainline Protestant","Restorationists Family","7","398","0.34"
"Christian Churches and Churches of Christ","Evangelical Protestant","Restorationists Family","4","699","0.60"
"Christian Congregation in North America","Evangelical Protestant","Pentecostal Family","1","",""
"Christian Methodist Episcopal Church","Black Protestant","Methodist Family","4","890","0.76"
"Christian Reformed Church in North America","Evangelical Protestant","Presbyterian/Reformed Family","2","106","0.09"
"Church of Christ, Scientist","Other Christians","Christian Science Family","5","",""
"Church of God (Anderson, Indiana)","Evangelical Protestant","Holiness Family","1","60","0.05"
"Church of God (Cleveland, Tennessee)","Evangelical Protestant","Pentecostal Family","12","675","0.58"
"Church of God in Christ","Black Protestant","Pentecostal Family","19","2,980","2.56"
"Church of God of Prophecy","Evangelical Protestant","Pentecostal Family","3","",""
"Church of Jesus Christ of Latter-day Saints","Latter-day Saints","Latter-day Saints (Mormonism) Family","40","25,240","21.65"
"Church of our Lord Jesus Christ of the Apostolic Faith, Inc.","Black Protestant","Pentecostal Family","1","180","0.15"
"Church of the Genuine Orthodox Christians of America","Orthodox","Eastern Liturgical (Orthodox) Family","1","80","0.07"
"Church of the Living God (Christian Workers for Fellowship)","Black Protestant","Pentecostal Family","2","",""
"Church of the Nazarene","Evangelical Protestant","Holiness Family","15","707","0.61"
"Churches of Christ","Evangelical Protestant","Restorationists Family","18","2,421","2.08"
"Community of Christ","Evangelical Protestant","Latter-day Saints (Mormonism) Family","1","",""
"Conservative Baptist Association of America (CBAmerica)","Evangelical Protestant","Baptist Family","9","",""
"Conservative Judaism","Judaism","Judaism Family","1","794","0.68"
"Converge Worldwide","Evangelical Protestant","Baptist Family","9","",""
"Coptic Orthodox Church","Orthodox","Eastern Liturgical (Orthodox) Family","1","600","0.51"
"ECO: A Covenant Order of Evangelical Presbyterians","Evangelical Protestant","Presbyterian/Reformed Family","2","",""
"Elim Fellowship","Evangelical Protestant","Pentecostal Family","1","",""
"Episcopal Church","Mainline Protestant","Anglican/Episcopal Family","12","3,565","3.06"
"Evangelical Covenant Church","Evangelical Protestant","Methodist Family","12","1,655","1.42"
"Evangelical Free Church of America","Evangelical Protestant","Methodist Family","6","",""
"Evangelical Friends Church International","Evangelical Protestant","Friends/Brethren Family","1","44","0.04"
"Evangelical Lutheran Church in America","Mainline Protestant","Lutheran Family","13","2,785","2.39"
"Evangelical Presbyterian Church (1981)","Evangelical Protestant","Presbyterian/Reformed Family","4","",""
"Fellowship of Fundamental Bible Churches","Evangelical Protestant","Methodist Family","1","",""
"Free Methodist Church – USA","Evangelical Protestant","Holiness Family","5","390","0.33"
"Full Gospel Baptist Church Fellowship International","Black Protestant","Baptist Family","5","900","0.77"
"Full Gospel Christian Assemblies International","Evangelical Protestant","Pentecostal Family","1","500","0.43"
"General Association of Regular Baptist Churches","Evangelical Protestant","Baptist Family","7","",""
"Greek Orthodox Archdiocese of America","Orthodox","Eastern Liturgical (Orthodox) Family","2","825","0.71"
"Hindu Yoga and Meditation","Hinduism","","7","828","0.71"
"Hindu, Traditional Temples","Hinduism","Hinduism Family","1","7,500","6.43"
"Independent Judaism","Judaism","","1","0","0.00"
"International Church of the Foursquare Gospel","Evangelical Protestant","Pentecostal Family","3","5,556","4.77"
"Jehovah's Witnesses","Jehovah's Witnesses","Adventist Family","48","12,368","10.61"
"Liberal Catholic Church, Province of the United States of America","Other Christians","Other Groups Family","1","",""
"Lutheran Church-Missouri Synod (LCMS)","Evangelical Protestant","Lutheran Family","13","1,558","1.34"
"Lutheran Congregations in Mission for Christ","Evangelical Protestant","Lutheran Family","1","218","0.19"
"Missionary Church, The","Evangelical Protestant","Holiness Family","1","33","0.03"
"Muslim Estimate","Islam","Islam Family","7","11,218","9.62"
"National Association of Free Will Baptists","Evangelical Protestant","Baptist Family","6","108","0.09"
"National Baptist Convention of America International, Inc.","Black Protestant","Baptist Family","1","180","0.15"
"National Baptist Convention, USA, Inc.","Black Protestant","Baptist Family","8","5,032","4.32"
"National Missionary Baptist Convention of America","Black Protestant","Baptist Family","21","5,470","4.69"
"New Apostolic Church USA","Other Christians","Other Groups Family","1","",""
"Non-denominational Christian Churches","Evangelical Protestant","Other Groups Family","49","19,840","17.02"
"North American Baptist Conference","Evangelical Protestant","Baptist Family","1","",""
"Open Bible Churches","Evangelical Protestant","Pentecostal Family","6","1,520","1.30"
"Orthodox Church in America, The","Orthodox","Eastern Liturgical (Orthodox) Family","1","67","0.06"
"Orthodox Judaism","Judaism","Judaism Family","0","120","0.10"
"Orthodox Presbyterian Church","Evangelical Protestant","Presbyterian/Reformed Family","1","",""
"Pentecostal Church of God","Evangelical Protestant","Pentecostal Family","9","",""
"Presbyterian Church (U.S.A.)","Mainline Protestant","Presbyterian/Reformed Family","12","3,841","3.29"
"Presbyterian Church in America","Evangelical Protestant","Presbyterian/Reformed Family","4","304","0.26"
"Reform Judaism","Judaism","Judaism Family","3","3,491","2.99"
"Salvation Army","Evangelical Protestant","Holiness Family","3","340","0.29"
"Serbian Orthodox Church in North and South America","Orthodox","Eastern Liturgical (Orthodox) Family","1","500","0.43"
"Seventh Day Baptist General Conference of the United States and Canada","Evangelical Protestant","Baptist Family","1","19","0.02"
"Seventh-day Adventist Church","Evangelical Protestant","Adventist Family","10","3,506","3.01"
"Southern Baptist Convention","Evangelical Protestant","Baptist Family","71","12,473","10.70"
"Swedenborgian Church","Other Christians","Spiritualist Family","1","39","0.03"
"The Church of God","Evangelical Protestant","","1","",""
"The Local Churches","Evangelical Protestant","","1","",""
"Unitarian Universalist Association","Other Christians","Liberal Family","2","920","0.79"
"United Church of Christ","Mainline Protestant","Congregationalists (United Church of Christ) Family","9","1,268","1.09"
"United Church of God","Other Christians","Adventist Family","1","",""
"United Methodist Church","Mainline Protestant","Methodist Family","20","4,603","3.95"
"United Pentecostal Church International","Evangelical Protestant","Pentecostal Family","8","",""
"United Reformed Churches in North America","Evangelical Protestant","Presbyterian/Reformed Family","1","89","0.08"
"Unity Churches, Association of","Other Christians","Other Groups Family","4","",""
"Wesleyan Church","Evangelical Protestant","Holiness Family","4","416","0.36"
"Wisconsin Evangelical Lutheran Synod","Evangelical Protestant","Lutheran Family","1","29","0.02"
" "," "," ","716.0","484,692.0"," "